{
  "schema_version": "1.0-draft",
  "status": "draft",
  "work_id": "lotm",
  "chapter": 1,
  "sources": [
    {
      "source_id": "zh",
      "language": "zh",
      "normalized_path": "data/normalized/v2/zh/ch_0001.json",
      "normalized_sha256": "ac3bd992e582783a335a97dbca5493eb78b1d03606d2823e3b949f6cc9093858"
    },
    {
      "source_id": "en",
      "language": "en",
      "normalized_path": "data/normalized/v2/en/ch_0001.json",
      "normalized_sha256": "789d93fed725fea45a78578911e1185f42c50c74fe963c5448be13055decd5b3"
    },
    {
      "source_id": "ru-official",
      "language": "ru",
      "normalized_path": "data/normalized/v2/ru-official/ch_0001.json",
      "normalized_sha256": "bc7f4234d0653014146f061f6eef9f623b450bfb01bcc86d751771823d46f03c"
    }
  ],
  "alignment_units": [
    {
      "id": "lotm:0001:a000001",
      "zh": {
        "paragraphs": [
          "lotm:zh:0001:p000001"
        ]
      },
      "en": {
        "paragraphs": [
          "lotm:en:0001:p000001"
        ]
      },
      "ru": {
        "paragraphs": [
          "lotm:ru-official:0001:p000001"
        ]
      },
      "flags": [],
      "note": null
    },
    {
      "id": "lotm:0001:a000002",
      "zh": {
        "paragraphs": [
          "lotm:zh:0001:p000002",
          "lotm:zh:0001:p000003",
          "lotm:zh:0001:p000004"
        ]
      },
      "en": {
        "paragraphs": [
          "lotm:en:0001:p000002",
          "lotm:en:0001:p000003",
          "lotm:en:0001:p000004"
        ]
      },
      "ru": {
        "paragraphs": [
          "lotm:ru-official:0001:p000002"
        ]
      },
      "flags": [],
      "note": null
    },
    {
      "id": "lotm:0001:a000003",
      "zh": {
        "paragraphs": [
          "lotm:zh:0001:p000005"
        ]
      },
      "en": {
        "paragraphs": [
          "lotm:en:0001:p000005"
        ]
      },
      "ru": {
        "paragraphs": [
          "lotm:ru-official:0001:p000003"
        ]
      },
      "flags": [],
      "note": null
    },
    {
      "id": "lotm:0001:a000004",
      "zh": {
        "paragraphs": [
          "lotm:zh:0001:p000006"
        ]
      },
      "en": {
        "paragraphs": [
          "lotm:en:0001:p000006"
        ]
      },
      "ru": {
        "paragraphs": [
          "lotm:ru-official:0001:p000004",
          "lotm:ru-official:0001:p000005"
        ]
      },
      "flags": [],
      "note": null
    },
    {
      "id": "lotm:0001:a000005",
      "zh": {
        "paragraphs": [
          "lotm:zh:0001:p000007",
          "lotm:zh:0001:p000008"
        ]
      },
      "en": {
        "paragraphs": [
          "lotm:en:0001:p000007",
          "lotm:en:0001:p000008"
        ]
      },
      "ru": {
        "paragraphs": [
          "lotm:ru-official:0001:p000006",
          "lotm:ru-official:0001:p000007"
        ]
      },
      "flags": [],
      "note": null
    },
    {
      "id": "lotm:0001:a000006",
      "zh": {
        "paragraphs": [
          "lotm:zh:0001:p000009",
          "lotm:zh:0001:p000010",
          "lotm:zh:0001:p000011",
          "lotm:zh:0001:p000012",
          "lotm:zh:0001:p000013",
          "lotm:zh:0001:p000014",
          "lotm:zh:0001:p000015",
          "lotm:zh:0001:p000016",
          "lotm:zh:0001:p000017"
        ]
      },
      "en": {
        "paragraphs": [
          "lotm:en:0001:p000009",
          "lotm:en:0001:p000010",
          "lotm:en:0001:p000011",
          "lotm:en:0001:p000012",
          "lotm:en:0001:p000013",
          "lotm:en:0001:p000014",
          "lotm:en:0001:p000015",
          "lotm:en:0001:p000016",
          "lotm:en:0001:p000017"
        ]
      },
      "ru": {
        "paragraphs": [
          "lotm:ru-official:0001:p000008",
          "lotm:ru-official:0001:p000009"
        ]
      },
      "flags": [],
      "note": null
    },
    {
      "id": "lotm:0001:a000007",
      "zh": {
        "paragraphs": [
          "lotm:zh:0001:p000018"
        ]
      },
      "en": {
        "paragraphs": [
          "lotm:en:0001:p000018"
        ]
      },
      "ru": {
        "paragraphs": [
          "lotm:ru-official:0001:p000010"
        ]
      },
      "flags": [],
      "note": null
    },
    {
      "id": "lotm:0001:a000008",
      "zh": {
        "paragraphs": [
          "lotm:zh:0001:p000019"
        ]
      },
      "en": {
        "paragraphs": [
          "lotm:en:0001:p000019"
        ]
      },
      "ru": {
        "paragraphs": [
          "lotm:ru-official:0001:p000011"
        ]
      },
      "flags": [],
      "note": null
    },
    {
      "id": "lotm:0001:a000009",
      "zh": {
        "paragraphs": [
          "lotm:zh:0001:p000020",
          "lotm:zh:0001:p000021"
        ]
      },
      "en": {
        "paragraphs": [
          "lotm:en:0001:p000020",
          "lotm:en:0001:p000021"
        ]
      },
      "ru": {
        "paragraphs": [
          "lotm:ru-official:0001:p000012",
          "lotm:ru-official:0001:p000013"
        ]
      },
      "flags": [],
      "note": null
    },
    {
      "id": "lotm:0001:a000010",
      "zh": {
        "paragraphs": [
          "lotm:zh:0001:p000022"
        ]
      },
      "en": {
        "paragraphs": [
          "lotm:en:0001:p000022"
        ]
      },
      "ru": {
        "paragraphs": [
          "lotm:ru-official:0001:p000014"
        ]
      },
      "flags": [],
      "note": null
    },
    {
      "id": "lotm:0001:a000011",
      "zh": {
        "paragraphs": [
          "lotm:zh:0001:p000023"
        ]
      },
      "en": {
        "paragraphs": [
          "lotm:en:0001:p000023"
        ]
      },
      "ru": {
        "paragraphs": [
          "lotm:ru-official:0001:p000015"
        ]
      },
      "flags": [],
      "note": null
    },
    {
      "id": "lotm:0001:a000012",
      "zh": {
        "paragraphs": [
          "lotm:zh:0001:p000024"
        ]
      },
      "en": {
        "paragraphs": [
          "lotm:en:0001:p000024"
        ]
      },
      "ru": {
        "paragraphs": [
          "lotm:ru-official:0001:p000016",
          "lotm:ru-official:0001:p000017"
        ]
      },
      "flags": [],
      "note": null
    },
    {
      "id": "lotm:0001:a000013",
      "zh": {
        "paragraphs": [
          "lotm:zh:0001:p000025"
        ]
      },
      "en": {
        "paragraphs": [
          "lotm:en:0001:p000025"
        ]
      },
      "ru": {
        "paragraphs": [
          "lotm:ru-official:0001:p000018"
        ]
      },
      "flags": [],
      "note": null
    },
    {
      "id": "lotm:0001:a000014",
      "zh": {
        "paragraphs": [
          "lotm:zh:0001:p000026"
        ]
      },
      "en": {
        "paragraphs": [
          "lotm:en:0001:p000026"
        ]
      },
      "ru": {
        "paragraphs": [
          "lotm:ru-official:0001:p000019"
        ]
      },
      "flags": [],
      "note": null
    },
    {
      "id": "lotm:0001:a000015",
      "zh": {
        "paragraphs": [
          "lotm:zh:0001:p000027"
        ]
      },
      "en": {
        "paragraphs": [
          "lotm:en:0001:p000027"
        ]
      },
      "ru": {
        "paragraphs": [
          "lotm:ru-official:0001:p000020"
        ]
      },
      "flags": [],
      "note": null
    },
    {
      "id": "lotm:0001:a000016",
      "zh": {
        "paragraphs": [
          "lotm:zh:0001:p000028"
        ]
      },
      "en": {
        "paragraphs": [
          "lotm:en:0001:p000028"
        ]
      },
      "ru": {
        "paragraphs": [
          "lotm:ru-official:0001:p000021",
          "lotm:ru-official:0001:p000022"
        ]
      },
      "flags": [],
      "note": null
    },
    {
      "id": "lotm:0001:a000017",
      "zh": {
        "paragraphs": [
          "lotm:zh:0001:p000029"
        ]
      },
      "en": {
        "paragraphs": [
          "lotm:en:0001:p000029"
        ]
      },
      "ru": {
        "gap": {
          "reason": "omission",
          "note": null
        }
      },
      "flags": [
        "omission"
      ],
      "note": null
    },
    {
      "id": "lotm:0001:a000018",
      "zh": {
        "paragraphs": [
          "lotm:zh:0001:p000030",
          "lotm:zh:0001:p000031",
          "lotm:zh:0001:p000032"
        ]
      },
      "en": {
        "paragraphs": [
          "lotm:en:0001:p000030",
          "lotm:en:0001:p000031",
          "lotm:en:0001:p000032"
        ]
      },
      "ru": {
        "paragraphs": [
          "lotm:ru-official:0001:p000023"
        ]
      },
      "flags": [],
      "note": null
    },
    {
      "id": "lotm:0001:a000019",
      "zh": {
        "paragraphs": [
          "lotm:zh:0001:p000033"
        ]
      },
      "en": {
        "paragraphs": [
          "lotm:en:0001:p000033"
        ]
      },
      "ru": {
        "paragraphs": [
          "lotm:ru-official:0001:p000024"
        ]
      },
      "flags": [],
      "note": null
    },
    {
      "id": "lotm:0001:a000020",
      "zh": {
        "paragraphs": [
          "lotm:zh:0001:p000034",
          "lotm:zh:0001:p000035"
        ]
      },
      "en": {
        "paragraphs": [
          "lotm:en:0001:p000034",
          "lotm:en:0001:p000035"
        ]
      },
      "ru": {
        "paragraphs": [
          "lotm:ru-official:0001:p000025"
        ]
      },
      "flags": [],
      "note": null
    },
    {
      "id": "lotm:0001:a000021",
      "zh": {
        "paragraphs": [
          "lotm:zh:0001:p000036",
          "lotm:zh:0001:p000037"
        ]
      },
      "en": {
        "paragraphs": [
          "lotm:en:0001:p000036"
        ]
      },
      "ru": {
        "paragraphs": [
          "lotm:ru-official:0001:p000026"
        ]
      },
      "flags": [],
      "note": null
    },
    {
      "id": "lotm:0001:a000022",
      "zh": {
        "paragraphs": [
          "lotm:zh:0001:p000038",
          "lotm:zh:0001:p000039",
          "lotm:zh:0001:p000040"
        ]
      },
      "en": {